Given a string A consisting of lowercase characters.Check if characters of the given string can be rearranged to form a palindrome.Return 1 if it is possible to rearrange the characters of the string A such that it becomes a palindrome else return 0. /splitsign/Hashing,palindrome,string,lowercase,rearrange,rearranged,characters,return,check,form,consisting,
Given two integers representing the numerator and denominator of a fraction, return the fraction in string format.If the fractional part is repeating, enclose the repeating part in parentheses. /splitsign/Hashing,fraction,fractional,denominator,numerator,parentheses,repeating,string,format,integers,return,
Given a stream of numbers A. On arrival of each number, you need to increase its first occurence by 1 and include this in the stream.Return the final stream of numbers. /splitsign/Hashing,stream,numbers,number,arrival,occurence,increase,return,final,include,given,
You are given a string, S, and a list of words, L, that are all of the same length.Find all starting indices of substring(s) in S that is a concatenation of each word in L exactly once and without any intervening characters. /splitsign/Hashing,substring,concatenation,string,list,indices,length,words,characters,word,starting,
Given a string A consisting only of '(' and ')'.You need to find whether parantheses in A is balanced or not ,if it is balanced then return 1 else return 0. /splitsign/Stacks And Queues,balanced,string,parantheses,return,consisting,given,need,
Implement a last-in-first-out (LIFO) stack using only two queues. The implemented stack should support all the functions of a normal stack (push, top, pop, and empty).Implement the MyStack class:void push(int x) Pushes element x to the top of the stack.int pop() Removes the element on the top of the stack and returns it.int top() Returns the element on the top of the stack.boolean empty() Returns true if the stack is empty, false otherwise. /splitsign/Stacks And Queues,stack,queues,lifo,mystack,implement,pop,push,void,functions,boolean,
Given a string A representing an absolute path for a file (Unix-style).Return the string A after simplifying the absolute path. /splitsign/Stacks And Queues,path,string,file,unix,simplifying,absolute,return,representing,given,style,
Given a string A denoting an expression. It contains the following operators ’+’, ‘-‘, ‘*’, ‘/’.Chech whether A has redundant braces or not.Return 1 if A has redundant braces, else return 0. /splitsign/Stacks And Queues,operators,string,expression,braces,redundant,contains,denoting,following,return,chech,
Given a string A denoting a stream of lowercase alphabets. You have to make new string B.B is formed such that we have to find first non-repeating character each time a character is inserted to the stream and append it at the end to B. If no non-repeating character is found then append '#' at the end of B. /splitsign/Stacks And Queues,string,alphabets,lowercase,append,repeating,inserted,stream,character,denoting,formed,
Given an array of integers A. There is a sliding window of size B which is moving from the very left of the array to the very right. You can only see the w numbers in the window. Each time the sliding window moves rightwards by one position. You have to find the maximum for each window. The following example will give you more clarity. /splitsign/Stacks And Queues,window,array,sliding,moves,integers,maximum,numbers,moving,position,rightwards,
Given an array, find the nearest smaller element G[i] for every element A[i] in the array such that the element has an index smaller than i.More formally,G[i] for an element A[i] = an element A[j] such that j is maximum possible AND  j < i AND A[j] < A[i]Elements for which no smaller element exist, consider next smaller element as -1. /splitsign/Stacks And Queues,nearest,index,array,smaller,element,elements,maximum,given,formally,exist,
Given an array of integers A .A represents a histogram i.e A[i] denotes height of the ith histogram's bar. Width of each bar is 1.Find the area of the largest rectangle formed by the histogram. /splitsign/Stacks And Queues,histogram,rectangle,largest,area,array,width,integers,bar,height,formed,
Given an integer array A of non-negative integers representing an elevation map where the width of each bar is 1, compute how much water it is able to trap after raining. /splitsign/Stacks And Queues,raining,array,elevation,water,compute,integers,integer,trap,map,width,
Given a string A consisting of lowercase characters. You have to find the number of substrings in A which starts with vowel and end with consonants or vice-versa. Return the count of substring modulo 109 + 7. /splitsign/Strings,substrings,substring,vowel,consonants,string,lowercase,modulo,109,characters,count,
Given the array of strings A, you need to find the longest string S which is the prefix of ALL the strings in the array. Longest common prefix for a pair of strings S1 and S2 is the longest string S which is the prefix of both S1 and S2. /splitsign/Strings,strings,string,longest,array,prefix,s2,s1,pair,common,given,
The count-and-say sequence is the sequence of integers beginning as follows:  1, 11, 21, 1211, 111221, ... 1 is read off as one 1 or 11. 11 is read off as two 1s or 21. 21 is read off as one 2, then one 1 or 1211. Given an integer n, generate the nth sequence. /splitsign/Strings,sequence,1211,integers,integer,111221,generate,count,11,21,beginning,
Given an string A. The only operation allowed is to insert characters in the beginning of the string. Find how many minimum characters are needed to be inserted to make the string a palindrome string. /splitsign/Strings,palindrome,string,inserted,minimum,insert,characters,operation,beginning,make,given,
Given an array of words and a length L, format the text such that each line has exactly L characters and is fully (left and right) justified. You should pack your words in a greedy approach; that is, pack as many words as you can in each line. Pad extra spaces ' ' when necessary so that each line has exactly L characters. Extra spaces between words should be distributed as evenly as possible. If the number of spaces on a line do not divide evenly between words, the empty slots on the left will be assigned more spaces than the slots on the right. For the last line of text, it should be left justified and no extra space is inserted between words. Your program should return a list of strings, where each string represents a single line. /splitsign/Strings,strings,words,string,spaces,text,array,slots,evenly,justified,line,
In the figure below, AB is the production-possibility curve of Canada. The line PQ shows the price ratio of one bushel of wheat/bale of cotton. The international price ratio is 0.25 bushels of wheat/bale of cotton as shown by the line RS. I1 and I2 are two of the community indifference curves of Canada. After Canada engages in free trade, it will: /splitsign/economy,ratio,wheat,price,canada,ab,cotton,bushel,curves,international,production,
In the figure below, AB is the production-possibility curve of Canada. I1 and I2 are two of the community indifference curves of Canada. In the absence of trade Canada will:Consider a two-country, two-commodity model. Each country has an increasing-cost production-possibility curve. In this model the amounts of the goods that are produced in a country in the no-trade situation are determined by: /splitsign/economy,commodity,production,curves,ab,indifference,canada,curve,goods,model,produced,
Assume that Country X produces two goods—sugar and shoes—and that the country's production possibility curve is "bowed-out." As the country produces more sugar the opportunity cost of sugar in terms of shoes foregone will /splitsign/economy,shoes,production,goods,sugar,bowed,produces,opportunity,country,terms,cost,
In the following figure, AB is the production-possibility curve of Canada. The line PQ shows the price ratio of one bushel of wheat/bale of cotton. The international price ratio is 0.25 bushels of wheat/bale of cotton as shown by the line RS. I1 and I2 are two of the community indifference curves of Canada. Which of the following can be inferred from this figure? /splitsign/economy,curves,ratio,curve,ab,figure,indifference,price,production,bushel,wheat,
In the figure below, AB is the production-possibility curve of Canada. I1 and I2 are two of the community indifference curves of Canada. With free trade, the international price ratio is 0.25 bushel of wheat/bale of cotton, and Canada will export: If trade corresponds to the Heckscher-Ohlin theory, which of the following is most likely to happen in the long run after a labor-abundant country engages in free trade? /splitsign/economy,heckscher,production,indifference,curves,labor,wheat,curve,canada,abundant,ohlin,
Country A is relatively land-abundant, and wheat is relatively land-intensive. Given the assumptions of the Heckscher-Ohlin model, the opening of trade by this country will cause the domestic price of wheat to /splitsign/economy,wheat,heckscher,country,abundant,land,model,domestic,ohlin,price,relatively,
The Stolper-Samuelson theorem predicts that free trade between the United States, a capital-abundant country, and Mexico, a labor-abundant country, would ultimately result inAccording to the Stolper-Samuelson theorem, a price change that reduces a country's production of its exportable product would /splitsign/economy,samuelson,stolper,exportable,theorem,labor,mexico,production,abundant,trade,united,
With a shift from no trade to free trade, if Country X is relatively labor-abundant and relatively land-scarce and Country Y is relatively labor-scarce and relatively land-abundant, the factor-price equalization theorem predicts that /splitsign/economy,equalization,factor,abundant,theorem,labor,country,relatively,scarce,land,price,
The following input-requirements data are for Country A, a capital-abundant country that produces nothing but bread and wine using only capital and labor as inputs. Based on this information, which of the following statements is true? /splitsign/economy,requirements,inputs,statements,capital,input,data,information,produces,country,abundant,
Which of the following can best explain the clustering of some industries, such as banking and finance in New York City and high-technology computer production in Silicon Valley? /splitsign/economy,industries,clustering,finance,banking,production,technology,silicon,valley,york,city,
Which of the following refers to a two-way trade in which a country both exports and imports the same or very similar products? /splitsign/economy,exports,imports,products,trade,country,similar,refers,following,way,
When Firm X doubled its output, it was found that its cost per unit declined by 10 percent. It can be concluded that /splitsign/economy,percent,doubled,firm,cost,unit,output,declined,concluded,10,
Suppose the amount of exports of textile machinery from Italy to the rest of the world equals 60 billion tons. The amount of imports of textile machinery into Italy from the rest of the world is 40 billion tons. Therefore, the intra-industry trade share for machinery is /splitsign/economy,exports,imports,industry,textile,machinery,italy,billion,trade,tons,share,
The Rybczynski theorem asserts that in a two-good model, assuming that product prices stay constant, growth in the endowment of one factor of production with the other factor remaining unchanged, will result in /splitsign/economy,rybczynski,endowment,growth,production,prices,theorem,model,product,constant,factor,
Assume that a large capital-abundant country trades only two goods with the rest of the world, medical equipment and corn. Medical equipment is relatively capital-intensive. An increase in the country's endowment of capital will cause the price of medical equipment relative to the price of corn to If trade is consistent with the Heckscher-Ohlin (H-O) theory, then growth in a country's scarce factor of production will lead to /splitsign/economy,growth,production,endowment,capital,abundant,goods,heckscher,scarce,medical,increase,
Assume a country produces only wine and cups. Both wine and cup production use land and labor as their only inputs. Wine production is relatively land-intensive while cup production is relatively labor-intensive. According to the Rybczynski theorem, a significant rise in immigration is most likely to lead to /splitsign/economy,immigration,labor,wine,production,cups,cup,country,produces,land,theorem,
Assume that a country produces only cloth and rice. Cloth production requires significant amounts of labor and capital, but relatively less land. Assume that rice production requires relatively less labor and capital, but relatively large amounts of land. If there is an increase in the country's endowments of capital and labor, the Rybczynski theorem predicts that: /splitsign/economy,rybczynski,labor,rice,production,endowments,theorem,cloth,produces,capital,requires,
Suppose Country A produces two goods, Good X and Good Y. Production of Good X involves an intensive use of skilled workers. Good Y is a relatively capital-intensive good. If the country experiences a wave of immigration of skilled workers, capital remaining unchanged, the Rybczynski theorem predicts that: /splitsign/economy,rybczynski,theorem,capital,immigration,skilled,production,workers,intensive,goods,country,
Suppose Country X produces only two goods, food and clothing. At the initial free-trade equilibrium, the country produced 40 units of food and 20 units of clothing, and it exports 10 units of food and imports 10 units of clothing. Now suppose technological innovation in Country X leads to a balanced growth while leaving the relative prices of food and clothing unchanged in the international market. Production of food in Country X rises to 50 units. If consumption of food rises to 42 units, the consumption of clothing /splitsign/economy,equilibrium,growth,exports,consumption,goods,production,clothing,food,innovation,market,
Which of the following correctly identifies the impact of tariffs on the producers of import-competing products in the imposing country? /splitsign/economy,tariffs,products,import,impact,imposing,producers,following,country,competing,identifies,
Which of the following is the basis for the consumption effect of a tariff imposed on imported automobiles? /splitsign/economy,tariff,consumption,automobiles,imported,effect,imposed,following,basis,
Which of the following refers to the extra cost of shifting to more expensive home production following the imposition of a tariff? /splitsign/economy,tariff,production,cost,imposition,expensive,shifting,extra,refers,following,home,
Under which of the following situations will a tariff imposed by a country fail to reduce imports by as much as expected? /splitsign/economy,tariff,imports,reduce,imposed,fail,country,following,situations,expected,
Which of the following is a means of allocating import licenses by assigning the licenses without competition, applications, or negotiation? /splitsign/economy,licenses,import,allocating,assigning,negotiation,competition,applications,following,means,
Which of the following is an expected effect of a tariff or a nontariff barrier (NTB) on a product?If there is something extra bad about local consumption of a product, then a tariff can be good for the country because /splitsign/economy,tariff,barrier,ntb,nontariff,consumption,effect,product,expected,extra,bad,
If Social Marginal Benefit (SMB) > Price (P) = Buyer's Private Marginal Benefit (MB) = Seller's Private Marginal Cost (MC) = Social Marginal Cost (SMC), it implies that /splitsign/economy,smb,marginal,smc,buyer,private,social,benefit,seller,cost,mc,
Which of the following refers to the positive or negative effect on parties who are not directly involved in a transaction? /splitsign/economy,transaction,effect,positive,parties,negative,involved,following,refers,directly,
Suppose manufacturing of paper results in substantial ground-water pollution. One possible policy that can be used to reduce the inefficiency caused by this externality is /splitsign/economy,pollution,inefficiency,manufacturing,paper,externality,policy,reduce,water,ground,caused,
Suppose that the domestic production of computer games creates enjoyment for those who play the games. Domestic production of computer games also results in knowledge spillovers that positively impact many other industries. One possible policy that could be employed to encourage increased production of computer games by domestic firms is /splitsign/economy,spillovers,industries,games,policy,production,firms,encourage,knowledge,enjoyment,computer,
Suppose that the training, skills, and attitudes received by employees in the computer gaming development industry have positive spillover effects as workers leave the industry and move to other jobs. The specificity rule suggests that the best way to achieve more employment in this industry is to /splitsign/economy,employment,spillover,industry,employees,jobs,gaming,specificity,development,training,workers,
Which of the following is said to occur when a firm lowers its price to limit the decline in the quantity sold during a period of recession? /splitsign/economy,recession,decline,lowers,quantity,firm,following,price,limit,occur,period,
Which of the following is said to occur when a firm with market power uses price discrimination between markets to increase its total profit? /splitsign/economy,markets,market,profit,discrimination,increase,firm,price,power,occur,following,
Which country had no antidumping cases until the early 1990s, but became the top initiator of antidumping cases for the time period 2012-2016? /splitsign/economy,antidumping,cases,1990s,2012,country,initiator,2016,period,early,time,
Which of the following allows member countries to import from other member countries freely, but imposes trade barriers against imports from outside countries? /splitsign/economy,imports,countries,barriers,import,freely,allows,imposes,trade,following,outside,
Which of the following states that any trade concession given to any foreign country must be given to all other countries having the same status? /splitsign/economy,countries,states,concession,foreign,country,status,given,trade,following,having,
The figure below shows the U.S. market for imported wine. For simplicity, we consider export supply curves to be flat. Chilean wine is available for $480 per barrel and French wine is available for $420 per barrel. /splitsign/economy,wine,chilean,imported,supply,export,market,french,barrel,480,available,
For which of the following types of environmental pollution can we expect that the level of environmental harm would increase as per capita income increases? /splitsign/economy,pollution,environmental,increases,increase,income,harm,types,capita,following,level,
As the world moves toward freer trade, the composition of production shifts so that more environmentally "dirty" products are produced in ________ and more environmentally "clean" products are produced in /splitsign/economy,production,environmentally,produced,products,composition,clean,freer,dirty,shifts,world,
In 1989 the United States passed a law against catching shrimp with nets that do not have turtle excluder devices. Four Asian countries filed a complaint with the Word Trade Organization (WTO), and it ruled that the U.S. policy violated WTO rules because /splitsign/economy,wto,shrimp,law,violated,turtle,catching,policy,complaint,states,excluder,
Which of the following exists when a market activity results in direct costs or benefits to someone who is not part of the marketplace decision to undertake the activity? /splitsign/economy,marketplace,market,costs,activity,benefits,undertake,direct,decision,following,results,
Which of the following is an example of an international externality, in which production (or consumption) activities in one country impose external costs on other countries? /splitsign/economy,externality,external,countries,production,consumption,international,costs,country,activities,impose,
If the use of fossil fuels is harming our nation, according to the specificity rule the optimal policy to use to mitigate this harm is to /splitsign/economy,fuels,policy,mitigate,specificity,optimal,harming,harm,fossil,rule,nation,
If the use of fossil fuels is harming our nation, according to the specificity rule the optimal policy to use to mitigate this harm is to /splitsign/economy,fuels,policy,mitigate,specificity,optimal,harming,harm,fossil,rule,nation,
Which of the following establishes international cooperation to prevent international trade from endangering the survival of species? /splitsign/economy,endangering,cooperation,species,prevent,international,survival,establishes,following,trade,
Which of the following involved industrial countries agreeing to cut their emissions of greenhouse gases to about 5 percent below their 1990 levels by the years 2008-2012 while developing countries did not make any commitments? /splitsign/economy,emissions,countries,industrial,greenhouse,gases,commitments,following,involved,developing,1990,
Which of the following was signed in 1987 and banned the exportation and importation of chlorofluorocarbon compounds (CFCs) and halons? /splitsign/economy,chlorofluorocarbon,cfcs,halons,compounds,exportation,importation,1987,banned,following,signed,
Which of the following was NOT a reason why the signing and enforcement of the Montreal Protocol was relatively easy? /splitsign/economy,montreal,protocol,signing,enforcement,reason,easy,relatively,following,
Given a string A, find the common palindromic sequence ( A sequence which does not need to be contiguous and is a pallindrome), which is common in itself.You need to return the length of longest palindromic subsequence in A. /splitsign/Dynamic Programming,palindromic,subsequence,contiguous,sequence,string,longest,length,common,pallindrome,given,
Given a string A, we may represent it as a binary tree by partitioning it to two non-empty substrings recursively.Below is one possible representation of A = “great”:To scramble the string, we may choose any non-leaf node and swap its two children.For example, if we choose the node “gr” and swap its two children, it produces a scrambled string “rgeat”.We say that “rgeat” is a scrambled string of “great”.Similarly, if we continue to swap the children of nodes “eat” and “at”, it produces a scrambled string “rgtae”.We say that “rgtae” is a scrambled string of “great”.Given two strings A and B of the same length, determine if B is a scrambled string of S. /splitsign/Dynamic Programming,scrambled,scramble,substrings,strings,binary,tree,string,recursively,nodes,swap,
Implement regular expression matching with support for '.' and '*'.'.' Matches any single character.'*' Matches zero or more of the preceding element.The matching should cover the entire input string (not partial).The function prototype should be:int isMatch(const char *s, const char *p) /splitsign/Dynamic Programming,string,ismatch,const,char,matching,expression,partial,regular,function,input,
Given A, B, C, find whether C is formed by the interleaving of A and B.Input Format:*The first argument of input contains a string, A.The second argument of input contains a string, B.The third argument of input contains a string, C. /splitsign/Dynamic Programming,interleaving,string,input,formed,contains,format,argument,given,second,
Given a binary grid A of size N x M consisting of 0's and 1's, find the area of the largest rectangle inside the grid such that all the cells inside the chosen rectangle should have 1 in them.You are allowed to permutate the columns matrix i.e. you can arrange each of the column in any order in the final grid.Please follow the sample input and explanation for more clarity. /splitsign/Dynamic Programming,grid,rectangle,matrix,columns,column,permutate,largest,cells,binary,area,
There are a row of N houses, each house can be painted with one of the three colors: red, blue or green.The cost of painting each house with a certain color is different. You have to paint all the houses such that no two adjacent houses have the same color.The cost of painting each house with a certain color is represented by a N x 3 cost matrix A.For example, A[0][0] is the cost of painting house 0 with color red; A[1][2] is the cost of painting house 1 with color green, and so on.Find the minimum total cost to paint all houses. /splitsign/Dynamic Programming,painting,paint,matrix,colors,painted,minimum,color,houses,cost,blue,
Find the longest increasing subsequence of a given array of integers, A.In other words, find a subsequence of array in which the subsequence’s elements are in strictly increasing order, and in which the subsequence is as long as possible. This subsequence is not necessarily contiguous, or unique.In this case, we only care about the length of the longest increasing subsequence. /splitsign/Dynamic Programming,subsequence,contiguous,longest,array,increasing,integers,length,long,elements,order,
