N light bulbs are connected by a wire.Each bulb has a switch associated with it, however due to faulty wiring, a switch also changes the state of all the bulbs to the right of current bulb.Given an initial state of all bulbs, find the minimum number of switches you have to press to turn on all the bulbs.You can press the same switch multiple times. /splitsign/Greedy Algorithm,switches,bulbs,bulb,switch,wiring,wire,multiple,light,turn,current,
N light bulbs are connected by a wire.Each bulb has a switch associated with it, however due to faulty wiring, a switch also changes the state of all the bulbs to the right of current bulb.Given an initial state of all bulbs, find the minimum number of switches you have to press to turn on all the bulbs.You can press the same switch multiple times. /splitsign/Greedy Algorithm,switches,bulbs,bulb,switch,wiring,wire,multiple,light,turn,current,
Given an integer array A of size N consisting of unique integers from 1 to N. You can swap any two integers atmost B times.Return the largest lexicographical value array that can be created by executing atmost B swaps. /splitsign/Greedy Algorithm,swap,swaps,array,integers,integer,largest,atmost,unique,lexicographical,value,
There are N children standing in a line. Each child is assigned a rating value.You are giving candies to these children subjected to the following requirements1. Each child must have at least one candy.2. Children with a higher rating get more candies than their neighbors. /splitsign/Greedy Algorithm,candy,candies,children,rating,neighbors,child,value,giving,line,higher,
There is a row of seats. Assume that it contains N seats adjacent to each other. There is a group of people who are already seated in that row randomly. i.e. some are sitting together & some are scattered.An occupied seat is marked with a character 'x' and an unoccupied seat is marked with a dot ('.')Now your target is to make the whole group sit together i.e. next to each other, without having any vacant seat between them in such a way that the total number of hops or jumps to move them should be minimum.Return minimum value % MOD where MOD = 10000003 /splitsign/Greedy Algorithm,seats,seat,jumps,seated,sitting,minimum,sit,group,hops,adjacent,
There are N Mice and N holes that are placed in a straight line. Each hole can accomodate only 1 mouse.The positions of Mice are denoted by array A and the position of holes are denoted by array B.A mouse can stay at his position, move one step right from x to x + 1, or move one step left from x to x − 1. Any of these moves consumes 1 minute.Assign mice to holes so that the time when the last mouse gets inside a hole is minimized. /splitsign/Greedy Algorithm,mice,mouse,minimized,holes,hole,array,assign,positions,position,moves,
Given two integer arrays A and B of size N.There are N gas stations along a circular route, where the amount of gas at station i is A[i].You have a car with an unlimited gas tank and it costs B[i] of gas to travel from station i to its next station (i+1). You begin the journey with an empty tank at one of the gas stations.Return the minimum starting gas station’s index if you can travel around the circuit once, otherwise return -1.You can only travel in one direction. i to i+1, i+2, … n-1, 0, 1, 2.. Completing the circuit means starting at i and ending up at i again. /splitsign/Greedy Algorithm,circuit,route,arrays,journey,travel,index,integer,circular,gas,stations,
Given an one-dimensional unsorted array A containing N integers.You are also given an integer B, find if there exists a pair of elements in the array whose difference is B.Return 1 if any such pair exists else return 0. /splitsign/Two Pointers,array,integers,integer,unsorted,pair,dimensional,elements,exists,return,given,
Given an array A of N non-negative numbers and you are also given non-negative number B.You need to find the number of subarrays in A having sum less than B. We may assume that there is no overflow. /splitsign/Two Pointers,subarrays,array,sum,numbers,overflow,number,having,negative,non,given,
Given an array A of positive integers,call a (contiguous,not necessarily distinct) subarray of A good if the number of different integers in that subarray is exactly B.Return the number of good subarrays of A. /splitsign/Two Pointers,subarrays,subarray,contiguous,array,distinct,integers,number,good,positive,necessarily,
You are given an integer array A containing N integers.You can remove atmost one subarray from it such that the remaining elements must occur atmost two times.Find the minimum size of the subarray you need to remove such that remaining elements must occur for atmost two times. /splitsign/Two Pointers,subarray,array,integers,integer,atmost,minimum,remove,elements,remaining,occur,
Given an array S of n integers, are there elements a, b, c in S such that a + b + c = 0? Find all unique triplets in the array which gives the sum of zero. /splitsign/Two Pointers,triplets,integers,sum,array,zero,elements,unique,gives,given,
Your task is to remove all the duplicates and return a sorted array of distinct elements consisting of all distinct elements present in A.But, instead of returning an answer array, you have to rearrange the given array in-place such that it resembles what has been described above. Hence, return a single integer, the index(1-based) till which the answer array would reside in the given array A. /splitsign/Two Pointers,array,distinct,duplicates,rearrange,elements,index,sorted,integer,remove,returning,
Find the intersection of two sorted arrays. OR in other words, Given 2 sorted arrays, find all the elements which occur in both the arrays. /splitsign/Two Pointers,arrays,intersection,sorted,elements,given,occur,words,
Given a sorted array, remove the duplicates in place such that each element can appear atmost twice and return the new length.Do not allocate extra space for another array, you must do this in place with constant memory. /splitsign/Two Pointers,array,duplicates,allocate,sorted,twice,atmost,memory,length,element,constant,
Given an array and a value, remove all the instances of that value in the array. Also return the number of elements left in the array after the operation.It does not matter what is left beyond the expected length. /splitsign/Two Pointers,array,length,remove,number,elements,operation,left,value,return,given,
Given an array with n objects colored red, white or blue, sort them so that objects of the same color are adjacent, with the colors in the order red, white and blue.Here, we will use the integers 0, 1, and 2 to represent the color red, white, and blue respectively. /splitsign/Two Pointers,sort,colors,array,blue,colored,color,red,objects,order,adjacent,
The set [1,2,3,…,n] contains a total of n! unique permutations.By listing and labeling all of the permutations in order,We get the following sequence (ie, for n = 3 ) : /splitsign/Backtracking,permutations,sequence,order,set,unique,labeling,listing,following,contains,total,
The gray code is a binary numeral system where two successive values differ in only one bit.Given a non-negative integer n representing the total number of bits in the code, print the sequence of gray code. A gray code sequence must begin with 0. /splitsign/Backtracking,binary,gray,code,numeral,bits,sequence,print,number,successive,values,
Given an integer n, return all distinct solutions to the n-queens puzzle.Each solution contains a distinct board configuration of the n-queens’ placement, where 'Q' and '.' both indicate a queen and an empty space respectively. /splitsign/Backtracking,queens,queen,board,solutions,solution,puzzle,integer,distinct,placement,contains,
There is given an integer array A of size N denoting the heights of N trees. Lumberjack Ojas needs to chop down B metres of wood. It is an easy job for him since he has a nifty new woodcutting machine that can take down forests like wildfire. However, Ojas is only allowed to cut a single row of trees. Ojas's machine works as follows: Ojas sets a height parameter H (in metres), and the machine raises a giant sawblade to that height and cuts off all tree parts higher than H (of course, trees not higher than H meters remain intact). Ojas then takes the parts that were cut off. For example, if the tree row contains trees with heights of 20, 15, 10, and 17 metres, and Ojas raises his sawblade to 15 metres, the remaining tree heights after cutting will be 15, 15, 10, and 15 metres, respectively, while Ojas will take 5 metres off the first tree and 2 metres off the fourth tree (7 metres of wood in total). Ojas is ecologically minded, so he doesn't want to cut off more wood than necessary. That's why he wants to set his sawblade as high as possible. Help Ojas find the maximum integer height of the sawblade that still allows him to cut off at least B metres of wood. /splitsign/BinarySearch,ojas,cutting,lumberjack,woodcutting,trees,cut,tree,cuts,sawblade,forests,
Given a sorted array of integers A(0 based index) of size N, find the starting and ending position of a given integar B in array A. Your algorithm’s runtime complexity must be in the order of O(log n). Return an array of size 2, such that first element = starting position of B in A and second element = ending position of B in A, if B is not found in A return [-1, -1]. /splitsign/BinarySearch,algorithm,array,complexity,index,sorted,integar,integers,position,order,runtime,
Given a matrix of integers A of size N x M and an integer B. Write an efficient algorithm that searches for integar B in matrix A. This matrix A has the following properties: 1. Integers in each row are sorted from left to right. 2. The first integer of each row is greater than or equal to the last integer of the previous row. Return 1 if B is present in A, else return 0. /splitsign/BinarySearch,algorithm,matrix,integers,integer,integar,searches,row,sorted,efficient,left,
Given an array of integers A of size N and an integer B. College library has N bags,the ith book has A[i] number of pages. You have to allocate books to B number of students so that maximum number of pages alloted to a student is minimum. A book will be allocated to exactly one student. Each student has to be allocated at least one book. Allotment should be in contiguous order for example: A student cannot be allocated book 1 and book 3, skipping book 2. Calculate and return that minimum possible number. /splitsign/BinarySearch,students,allocated,books,allocate,bags,array,contiguous,library,minimum,student,
Given an array of integers A of size N and an integer B. array A is rotated at some pivot unknown to you beforehand. (i.e., 0 1 2 4 5 6 7 might become 4 5 6 7 0 1 2 ). You are given a target value B to search. If found in the array, return its index, otherwise return -1. You may assume no duplicate exists in the array. /splitsign/BinarySearch,array,index,integers,integer,rotated,search,pivot,target,duplicate,value,
There are many people who believe that the earth is flat and NASA is a scam. They call themselves Flat Earthers. They were already worried that the 6 feet social distancing rule might push some people out of the earth. Now, they decided to think about a new issue. Since the earth is flat ( or so they think), let's imagine it as an infinite 2D grid. They have the coordinates of certain points which are orange zones and have some COVID-19 cases reported. Now each day the orange zones become more fatal. After d days, all the locations within a euclidean distance of d of a particular orange zone can be affected by this zone. They know N orange zones, each of whose coordinates are given by (A[i][0], A[i][1]). Now, a location is considered a red zone if it is affected by at least B orange zones. You need to find the first day at which the first red zone is reported. /splitsign/BinarySearch,zones,earth,zone,distancing,earthers,flat,covid,coordinates,distance,nasa,
In 2016, Congress passed a law that intended to improve transportation in rural areas, relying on the Department of Transportation to figure out the mode of transportation was strongest. Senator Tahani Al-Jamil has heard that the Department of Transportation is planning to institute a regulation requiring state governments to give every person living in a rural area a brand-new car, which was not the intent of the law. However, she’s not sure if this is gossip or an actual plan. /splitsign/politics,transportation,rural,regulation,congress,car,law,governments,planning,requiring,state,
“The Second Amendment was adopted to protect the right of the people of each of the several States to maintain a well-regulated militia. It was a response to concerns raised during the ratification of the Constitution that the power of Congress to disarm the state militias and create a national standing army posed an intolerable threat to the sovereignty of the several States. Neither the text of the Amendment nor the arguments advanced by its proponents evidenced the slightest interest in limiting any legislature’s authority to regulate private civilian uses of firearms. Specifically, there is no indication that the Framers of the Amendment intended to enshrine the common-law right of self-defense in the Constitution.”“Because of our two-party system, voters often find themselves voting for the ‘lesser of two evils,’ rather than a candidate they really feel would do the best job. . . ."Since most states distribute their electoral votes on a winner-take-all basis, the smaller party has no chance to gain support without seeming to take this support from one of the major parties. Few people will support a party that never wins, especially when they are supporting that party at the possible expense of their least favorite candidate taking power.”". . . without debate, without criticism, no administration and no country can succeed—and no republic can survive . . . that is why our press was protected by the First Amendment--the only business in America specifically protected by the Constitution . . . ”"When the Articles of Confederation were drafted, Americans had little experience of what a national government could do for them and bitter experience of what an arbitrary government could do to them. In creating a central government they were therefore more concerned with keeping it under control than with giving it the means to do its job."“The character of every act depends upon the circumstances in which it is done. The most stringent protection of free speech would not protect a man in falsely shouting fire in a theatre and causing a panic.”“9/11 significantly increased political participation of the affected populations . . . Families and neighbors became more involved in politicized activities, including the selection of party nominees and in providing financial support to favored candidates . . . Finally, although families, and to a lesser extent neighbors, became more involved in their own parties’ activities, there was an average shift in allegiance to the Republican Party.”“The Constitution abhors classifications based on race, not only because those classifications can harm favored races or are based on illegitimate motives, but also because every time the government places citizens on racial registers and makes race relevant to the provision of burdens or benefits, it demeans us all. . . . Undoubtedly there are other ways to ‘better’ the education of law students aside from ensuring that the student body contains a ‘critical mass’ of underrepresented minority students.“The defeat of Robert Bork’s 1987 Supreme Court nomination was a watershed event that unleashed what Stephen Carter has called ‘the confirmation mess.’ There was no question that Bork was a highly qualified nominee. He was rejected not because of any lack of qualification, or any impropriety, but because of his stated judicial philosophy: how he would vote as a judge.”“[I]t has already been incontrovertibly shown that on the present occasion a bill of rights was totally unnecessary, and that it might be accompanied with some inconveniency and danger if there was any defect in the attempt to enumerate the privileges of the people. This system proposes a union of thirteen sovereign and independent states in order to give dignity and energy to the transaction of their common concerns. It would be idle, therefore to countenance the idea that any other powers were delegated to the general government than those specified in the Constitution itself.”“Thus every man, by agreeing with others to make one body politic under one government, puts himself under an obligation to everyone in that society to submit to the decisions of the majority, and to be bound by it. Otherwise—that is, if he were willing to submit himself only to the majority acts that he approved of—the original compact through which he and the others incorporated into society would be meaningless . . .” /splitsign/politics,militia,firearms,amendment,militias,constitution,regulated,protect,legislature,sovereignty,regulate,
In 1895, the Supreme Court heard a case about the Income Tax Act of 1894. The Court held that the act was unconstitutional and the federal government did not have the power to tax personal income.Senator Leslie Knope plans to vote in favor of two major bills. The first bill is about buying some land in Indiana and turning it into a national park. The second bill will ban any fast food restaurant from serving a 128-ounce soft drink. 21,000 constituents have called her asking her to vote against the second bill, but no constituents have called her about the national park bill. Senator Knope decides to vote in favor of the first bill, but listens to her constituents and votes against the second bill.The presidential election of 1968 was conducted against a backdrop of assassinations, race riots, widespread demonstrations against the Vietnam war, and violent confrontations between police and anti-war protesters at the Democratic National Convention.It also included a strong third party effort by former Alabama Governor George Wallace, a pro-segregation Democrat running as independent. The election outcome was a victory for GOP candidate Richard Nixon, with Wallace receiving 46 electoral votes from southern states.The House Committee on Veterans Affairs, the Department of Veterans Affairs, and the VFW (Veterans of Foreign Wars) work together to achieve policies that benefit veterans.“Who can say that the legislature of Alabama which set up that state's segregation laws was democratically elected? Throughout Alabama all sorts of devious methods are used to prevent Negroes from becoming registered voters, and there are some counties in which, even though Negroes constitute a majority of the population, not a single Negro is registered. Can any law enacted under such circumstances be considered democratically structured?” /splitsign/politics,nixon,gop,presidential,senator,unconstitutional,election,voters,1968,legislature,governor,
In 1988 and 1989, the Pennsylvania legislature amended its abortion control law. The changes included requiring a 24 hour waiting period for the procedure and that a married woman must notify her husband that she intends to have an abortion. In a 5-4 ruling, the Court upheld most of the Pennsylvania laws because they did not create a “substantial obstacle” to a woman seeking an abortion. This became known as the undue-burden test.“This week, we have twice seen Supreme Court Justices violating their judicial oaths. Yesterday, the Justices re-wrote Obamacare, yet again, in order to force this failed law on the American people. Today, the Court doubled down with a 5-4 opinion that undermines not just the definition of marriage, but the very foundations of our representative form of government. . . . That is unacceptable. On the substantive front, I have already introduced a constitutional amendment to preserve the authority of elected state legislatures to define marriage as the union of one man and one woman, and also legislation stripping the federal courts of jurisdiction over legal assaults on marriage.”“There are other good things of less moment. I will now add what I do not like [about the Constitution]. First the omission of a bill of rights providing clearly & without the aid of sophisms for freedom of religion, freedom of the press, protection against standing armies, restriction against monopolies, the eternal & unremitting force of the habeas corpus laws, and trials by jury in all matters of fact triable by the laws of the land & not by the law of Nations. . . . Let me add that a bill of rights is what the people are entitled to against every government on earth, general or particular, & what no just government should refuse or rest on inference.”Anthony is concerned by his state government’s efforts to decrease regulations on pesticides that could hurt the bee population. He decides to join the League of Conservation Voters to help them lobby against deregulating pesticides.“Universities cannot establish quotas for members of certain racial or ethnic groups or put them on separate admissions tracks. The Law School's admissions program . . . satisfies these requirements. Moreover, the program is flexible enough to ensure that each applicant is evaluated as an individual and not in a way that makes race or ethnicity the defining feature of the application. The Law School engages in a highly individualized, holistic review of each applicant's file, giving serious consideration to all the ways an applicant might contribute to a diverse educational environment.” /splitsign/politics,constitution,constitutional,abortion,amendment,justices,judicial,obamacare,amended,courts,pennsylvania,
Congress passed a law that tasked the Department of Homeland Security with developing an emergency communication system to alert residents. The department has defined emergency communications as information important to most citizens. Under that definition, the head of Homeland Security has used the system to send out spoilers for the tv show, Derry Girls.“As long as the reason of man continues fallible, and he is at liberty to exercise it, different opinions will be formed . . . The diversity in the faculties of men, from which the rights of property originate, is not less an insuperable obstacle to a uniformity of interests. The protection of these faculties is the first object of government. From the protection of different and unequal faculties of acquiring property, the possession of different degrees and kinds of property immediately results; and from the influence of these on the sentiments and views of the respective proprietors, ensues a division of the society into different interests and parties.”A president issues an executive order banning newspapers from printing articles critical of the US government. The Supreme Court declares the executive order unconstitutional because it violates the First Amendment right to freedom of the press.“As we consider whether to reauthorize parts of the PATRIOT Act, we must take stock of where we are today. It is no secret that NSA collects vast sums of information and at one point or another has collected information on virtually every person in this country who uses a telephone. That is no great secret. Since June 2013, we have learned that the NSA collects phone call metadata, including the numbers of both parties, location, time, and duration. They collect text messages, email chat, and Internet browsing history; smart phone app data, including Google Maps, which can pinpoint a person's location to within a few yards. They collect maps of people's social networks, bank and credit card transactions. This is just the tip of the iceberg. There is undoubtedly much more being done that we simply don't know anything about.”“The collection of telephone metadata in bulk facilitates our mapping of terrorist networks and our ability to disrupt terrorist plots. Contrary to the wild fantasies that critics frequently spout, this collection does not meaningfully intrude on our privacy. It does not involve the NSA listening in on anyone's calls. It is simply a very important means of finding a proverbial needle in a haystack. We should reauthorize this authority without delay.”"Our Debts being unfunded and unprovided for, the Interest cannot be paid. Those therefore who trusted us in the Hour of Distress are defrauded. To expect that under such Circumstances others will confide in the Government would be Folly, and to expect that Foreigners will Trust a Government which has no Credit with its own Citizens must be madness . . ."The United States have call’d for eight Million of Dollars early in November last, of which the first quarterly Payment was to have been made on the first Day of April next. But I cannot find that a single State has laid the Taxes." /splitsign/politics,nsa,security,unconstitutional,citizens,privacy,government,authority,terrorist,amendment,protection,
