It’s Tushar’s birthday today and he has N friends.Friends are numbered [0, 1, 2, ...., N-1] and ith friend have a positive strength B[i].Today being his birthday, his friends have planned to give him birthday bombs (kicks).Tushar's friends know Tushar's pain bearing limit and would hit accordingly.If Tushar’s resistance is denoted by A (>=0) then find the lexicographically smallest order of friends to kick Tushar so that the cumulative kick strength (sum of the strengths of friends who kicks) doesn’t exceed his resistance capacity and total no. of kicks hit are maximum.Also note that each friend can kick unlimited number of times (If a friend hits x times, his strength will be counted x times)Return the lexicographically smallest array of maximum length where the ith index represents the index of the friend who will hit. /splitsign/Dynamic Programming,tushar,maximum,kick,kicks,strength,hits,resistance,bombs,exceed,birthday,
Given an array of non-negative integers, A, of length N, you are initially positioned at the first index of the array.Each element in the array represents your maximum jump length at that position.Return the minimum number of jumps required to reach the last index.If it is not possible to reach the last index, return -1. /splitsign/Dynamic Programming,jumps,jump,array,maximum,minimum,integers,index,reach,length,number,
Find out the number of N digit numbers, whose digits on being added equals to a given number S. Note that a valid number starts from digits 1-9 except the number 0 itself. i.e. leading zeroes are not allowed.Since the answer can be large, output answer modulo 1000000007 /splitsign/Dynamic Programming,digits,digit,numbers,number,1000000007,modulo,zeroes,output,equals,added,
Given a 3 x A board, find the number of ways to color it using at most 4 colors such that no 2 adjacent boxes have same color.Diagonal neighbors are not treated as adjacent boxes.Return the ways modulo 109 + 7 as the answer grows quickly. /splitsign/Dynamic Programming,colors,board,color,adjacent,diagonal,boxes,modulo,neighbors,109,number,
There are A coins (Assume A is even) in a line.Two players take turns to take a coin from one of the ends of the line until there are no more coins left.The player with the larger amount of money wins, Assume that you go first.Return the maximum amount of money you can win. /splitsign/Dynamic Programming,coin,coins,maximum,win,ends,wins,turns,players,line,money,
You are given A eggs, and you have access to a building with B floors from 1 to B.Each egg is identical in function, and if an egg breaks, you cannot drop it again.You know that there exists a floor C with 0 <= C <= B such that any egg dropped at a floor higher than C will break, and any egg dropped at or below floor C will not break.Each move, you may take an egg (if you have an unbroken one) and drop it from any floor X (with 1 <= X <= B). Your goal is to know with certainty what the value of C is.What is the minimum number of moves that you need to know with certainty what C is, regardless of the initial value of C /splitsign/Dynamic Programming,moves,egg,floors,eggs,floor,minimum,drop,building,certainty,dropped,
Given a tree with N nodes numbered from 1 to N.Each edge is bi-directional and has a certain weight assigned to it.You are given Q queries, in each query you are given two integers u and v and you are required to find the maximum weighted edge in a simple path from u to v.You have to return the weight of the edge for each queries. /splitsign/Dynamic Programming,weighted,nodes,tree,maximum,weight,queries,edge,query,path,directional,
Two kingdoms are on a war right now, kingdom X and kingdom Y. As a war specialist of kingdom X, you scouted kingdom Y area.A kingdom area is defined as a N x M grid with each cell denoting a village.Each cell has a value which denotes the strength of each corresponding village.The strength can also be negative, representing those warriors of your kingdom who were held hostages.There’s also another thing to be noticed.The strength of any village on row larger than one (2<=r<=N) is stronger or equal to the strength of village which is exactly above it.The strength of any village on column larger than one (2<=c<=M) is stronger or equal to the strength of vilage which is exactly to its left.(stronger means having higher value as defined above).So your task is, find the largest sum of strength that you can erase by bombing one sub-matrix in the grid. /splitsign/Dynamic Programming,kingdoms,grid,kingdom,matrix,cell,warriors,bombing,stronger,war,area,
Given an integer array A containing N integers.You need to divide the array A into two subsets S1 and S2 such that the absolute difference between their sums is minimum.Find and return this minimum possible absolute difference. /splitsign/Dynamic Programming,sums,integers,integer,minimum,array,subsets,divide,s1,s2,absolute,
The demons had captured the princess (P) and imprisoned her in the bottom-right corner of a dungeon. The dungeon consists of M x N rooms laid out in a 2D grid. Our valiant knight (K) was initially positioned in the top-left room and must fight his way through the dungeon to rescue the princess.The knight has an initial health point represented by a positive integer. If at any point his health point drops to 0 or below, he dies immediately.Some of the rooms are guarded by demons, so the knight loses health (negative integers) upon entering these rooms; other rooms are either empty (0’s) or contain magic orbs that increase the knight’s health (positive integers).In order to reach the princess as quickly as possible, the knight decides to move only rightward or downward in each step.Write a function to determine the knight’s minimum initial health so that he is able to rescue the princess.For example, given the dungeon below, the initial health of the knight must be at least 7 if he follows the optimal pathRIGHT-> RIGHT -> DOWN -> DOWN. /splitsign/Dynamic Programming,knight,dungeon,optimal,princess,grid,step,rescue,function,health,rooms,
There is a rod of length N lying on x-axis with its left end at x = 0 and right end at x = N. Now, there are M weak points on this rod denoted by positive integer values(all less than N) A1, A2, …, AM. You have to cut rod at all these weak points. You can perform these cuts in any order. After a cut, rod gets divided into two smaller sub-rods. Cost of making a cut is the length of the sub-rod in which you are making a cut.Your aim is to minimise this cost. Return an array denoting the sequence in which you will make cuts. If two different sequences of cuts give same cost, return the lexicographically smallest. /splitsign/Dynamic Programming,cuts,cut,minimise,rods,rod,smallest,sequences,cost,sequence,smaller,
Say you have an array, A, for which the ith element is the price of a given stock on day i.If you were only permitted to complete at most one transaction (i.e, buy one and sell one share of the stock), design an algorithm to find the maximum profit.Return the maximum possible profit. /splitsign/Dynamic Programming,profit,algorithm,maximum,stock,array,sell,buy,share,price,transaction,
You are given a sequence of black and white horses, and a set of K stables numbered 1 to K. You have to accommodate the horses into the stables in such a way that the following conditions are satisfied:You fill the horses into the stables preserving the relative order of horses. For instance, you cannot put horse 1 into stable 2 and horse 2 into stable 1. You have to preserve the ordering of the horses.No stable should be empty and no horse should be left unaccommodated.Take the product (number of white horses * number of black horses) for each stable and take the sum of all these products. This value should be the minimum among all possible accommodation arrangements /splitsign/Dynamic Programming,stables,horses,arrangements,horse,accommodation,ordering,accommodate,stable,order,minimum,
Given an integer array A of size N. You have to merge all the elements of the array into one with the minimum possible cost.The rule for merging is as follows:·  Choose any two adjacent elements of the array with values say X and Y and merge them into a single element with value (X + Y) paying a total cost of (X + Y).Return the minimum possible cost of merging all elements. /splitsign/Dynamic Programming,merging,array,merge,minimum,integer,cost,total,adjacent,paying,values,
As it is Tushar’s Birthday on March 1st, he decided to throw a party to all his friends at TGI Fridays in Pune.Given are the eating capacity of each friend, filling capacity of each dish and cost of each dish. A friend is satisfied if the sum of the filling capacity of dishes he ate is equal to his capacity. Find the minimum cost such that all of Tushar’s friends are satisfied (reached their eating capacity). /splitsign/Dynamic Programming,minimum,tushar,eating,capacity,dishes,sum,filling,pune,dish,party,
Given two integer arrays A and B of size N each which represent values and weights associated with N items respectively.Also given an integer C which represents knapsack capacity.Find out the maximum value subset of A such that sum of the weights of this subset is smaller than or equal to C. /splitsign/Dynamic Programming,knapsack,arrays,weights,subset,capacity,maximum,sum,integer,values,value,
Say you have an array, A, for which the ith element is the price of a given stock on day i.Design an algorithm to find the maximum profit.You may complete as many transactions as you like (i.e., buy one and sell one share of the stock multiple times).However, you may not engage in multiple transactions at the same time (ie, you must sell the stock before you buy again). /splitsign/Dynamic Programming,profit,algorithm,transactions,stock,array,multiple,maximum,sell,buy,share,
Max Heap is a special kind of complete binary tree in which for every node the value present in that node is greater than the value present in it’s children nodes.Find the number of distinct Max Heap can be made from A distinct integers.In short, you have to ensure the following properties for the max heap :Heap has to be a complete binary tree ( A complete binary tree is a binary tree in which every level, except possibly the last, is completely filled, and all nodes are as far left as possible.)Every node is greater than all its children. /splitsign/Heaps And Maps,heap,max,binary,tree,integers,distinct,nodes,greater,node,children,
Given two integers arrays A and B of size N each.Find the maximum N elements from the sum combinations (Ai + Bj) formed from elements in array A and B. /splitsign/Heaps And Maps,arrays,combinations,maximum,array,sum,bj,integers,ai,formed,elements,
Given an array A , representing seats in each row of a stadium. You need to sell tickets to B people.Each seat costs equal to the number of vacant seats in the row it belongs to. The task is to maximize the profit by selling the tickets to B people. /splitsign/Heaps And Maps,tickets,seats,stadium,profit,maximize,array,row,selling,sell,costs,
Given N bags, each bag contains Bi chocolates. There is a kid and a magician. In one unit of time, kid chooses a random bag i, eats Bi chocolates, then themagician fills the ith bag with floor(Bi/2) chocolates.Find the maximum number of chocolates that kid can eat in A units of time. /splitsign/Heaps And Maps,chocolates,maximum,random,bags,themagician,fills,units,bi,bag,chooses,
Given two equally sized 1-D arrays A, B containing N integers each.A sum combination is made by adding one element from array A and another element of array B.Return the maximum C valid sum combinations from all the possible sum combinations. /splitsign/Heaps And Maps,combinations,combination,arrays,array,sum,maximum,integers,adding,sized,valid,
You are given an array of N integers, A1, A2 ,..., AN and an integer B. Return the of count of distinct numbers in all windows of size B. Formally, return an array of size N-B+1 where i'th element in this array contains number of distinct elements in sequence Ai, Ai+1 ,..., Ai+B-1.Design and implement a data structure for LRU (Least Recently Used) cache. It should support the following operations: get and set. /splitsign/Heaps And Maps,distinct,array,lru,numbers,count,sequence,integers,number,integer,windows,
Given a binary search tree A, where each node contains a positive integer, and an integer B, you have to find whether or not there exist two different nodes X and Y such that X.value + Y.value = B.Return 1 to denote that two such nodes exist. Return 0, otherwise. /splitsign/Tree Data Structure,binary,tree,nodes,node,integer,search,contains,value,return,exist,
Implement an iterator over a binary search tree (BST). Your iterator will be initialized with the root node of a BST.The first call to next() will return the smallest number in BST. Calling next() again will return the next smallest number in the BST, and so on. /splitsign/Tree Data Structure,smallest,binary,tree,iterator,node,bst,number,search,root,initialized,
Given a set of reviews provided by the customers for different hotels and a string containing Good Words, you need to sort the reviews in descendingorderaccording to their Goodness Value (Higher goodness value first). We define the Goodness Value of a string as the number of Good Words in that string.NOTE: Sorting should be stable. If review i and review j have the same Goodness Value then their original order would be preserved.You are expected to use Trie in an Interview for such problems /splitsign/Tree Data Structure,sorting,sort,review,reviews,order,trie,hotels,descendingorderaccording,words,string,
Given a binary tree denoted by root node A and a leaf node B from this tree.It is known that all nodes connected to a given node (left child, right child and parent) get burned in 1 second. Then all the nodes which are connected through one intermediate get burned in 2 seconds, and so on.You need to find the minimum time required to burn the complete binary tree. /splitsign/Tree Data Structure,tree,nodes,node,seconds,burned,binary,burn,root,leaf,minimum,
Given a binary tree, find its maximum depth.The maximum depth of a binary tree is the number of nodes along the longest path from the root node down to the farthest leaf node. /splitsign/Tree Data Structure,tree,depth,nodes,farthest,binary,node,maximum,leaf,root,longest,
Given a binary tree containing digits from 0-9 only, each root-to-leaf path could represent a number.An example is the root-to-leaf path 1->2->3 which represents the number 123.Find the total sum of all root-to-leaf numbers % 1003. /splitsign/Tree Data Structure,digits,tree,numbers,sum,binary,number,1003,root,leaf,123,
Given a binary treestruct TreeLinkNode {TreeLinkNode *left;TreeLinkNode *right;TreeLinkNode *next; }Populate each next pointer to point to its next right node. If there is no next right node, the next pointer should be set to NULL.Initially, all next pointers are set to NULL. /splitsign/Tree Data Structure,treelinknode,treestruct,pointer,pointers,null,node,binary,populate,point,initially,
Given a binary tree A of integers. Return an array of integers representing the right view of the Binary tree.Right view of a Binary Tree: is a set of nodes visible when the tree is visited from Right side. /splitsign/Tree Data Structure,tree,binary,view,nodes,array,integers,visible,representing,return,visited,
You are given the following :A positive number NHeights : A list of heights of N persons standing in a queueInfronts : A list of numbers corresponding to each person (P) that gives the number of persons who are taller than P and standing in front of PYou need to return list of actual order of persons’s height /splitsign/Tree Data Structure,heights,height,standing,taller,numbers,persons,number,list,queueinfronts,order,
Given two binary trees, write a function to check if they are equal or not.Two binary trees are considered equal if they are structurally identical and the nodes have the same value.Return 0 / 1 ( 0 for false, 1 for true ) for this problem /splitsign/Tree Data Structure,binary,equal,trees,nodes,function,identical,value,return,check,false,
There is a corridor in a Jail which is N units long. Given an array A of size N. The ith index of this array is 0 if the light at ith position is faulty otherwise it is 1. All the lights are of specific power B which if is placed at position X, it can light the corridor from [ X-B+1, X+B-1 ]. Initially all lights are off. Return the minimum number of lights to be turned ON to light the whole corridor or -1 if the whole corridor cannot be lighted. /splitsign/Arrays,lights,light,lighted,array,corridor,minimum,index,number,jail,power,
Given a non-negative number represented as an array of digits, add 1 to the number ( increment the number represented by the digits ). The digits are stored such that the most significant digit is at the head of the list. /splitsign/Arrays,digits,digit,number,increment,array,list,stored,significant,represented,head,
Given a character matrix of size N x M in the form of a string array A of size N where A[i] denotes ith row. Each character in the matrix consists any one of the following three characters {'r', 'g', 'b'} where 'r' denotes red color similarly 'g' denotes green color and 'b' denotes blue color. You have to find the area of the largest triangle that has one side parallel to y-axis i.e vertical and the color of all three vertices are different. /splitsign/Arrays,matrix,triangle,string,vertices,array,color,characters,red,row,blue,
You are given a binary string A consisting of characters A1, A2, ..., AN. In a single operation, you can choose two indices L and R such that 1 ≤ L ≤ R ≤ N and flip the characters AL, AL+1, ..., AR. By flipping, we mean change character 0 to 1 and vice-versa. Your aim is to perform ATMOST one operation such that in final string number of 1s is maximised. If you don't want to perform the operation, return an empty array. Else, return an array consisting of two elements denoting L and R. If there are multiple solutions, return the lexicographically smallest pair of L and R. /splitsign/Arrays,binary,string,flip,flipping,array,indices,operation,lexicographically,al,a1,
Given an integer array A of size N. You need to check that whether there exist a element which is strictly greater than all the elements on left of it and strictly smaller than all the elements on right of it. If it exists return 1 else return 0. /splitsign/Arrays,array,integer,elements,element,check,exists,return,exist,smaller,right,
Given an integer array A of size N. You need to count the number of special elements in the given array. A element is special if removal of that element make the array balanced. Array will be balanced if sum of even index element equal to sum of odd index element. /splitsign/Arrays,balanced,array,integer,elements,element,sum,number,count,index,equal,
A hotel manager has to process N advance bookings of rooms for the next season. His hotel has C rooms. Bookings contain an arrival date and a departure date. He wants to find out whether there are enough rooms in the hotel to satisfy the demand. Write a program that solves this problem in time O(N log N) . /splitsign/Arrays,bookings,hotel,rooms,program,problem,arrival,demand,solves,log,advance,
You're given a read only array of n integers. Find out if any integer occurs more than n/3 times in the array in linear time and constant additional space. If so, return the integer. If not, return -1. If there are multiple solutions, return any one. /splitsign/Arrays,array,integer,integers,linear,solutions,return,multiple,constant,space,given,
Given the position of a Bishop (A, B) on an 8 * 8 chessboard. Your task is to count the total number of squares that can be visited by the Bishop in one move. The position of the Bishop is denoted using row and column number of the chessboard. /splitsign/Math,chessboard,squares,bishop,row,column,count,position,number,visited,total,
Hamming distance between two non-negative integers is defined as the number of positions at which the corresponding bits are different. Given an array A of N non-negative integers, find the sum of hamming distances of all pairs of integers in the array. Return the answer modulo 1000000007. /splitsign/Math,hamming,distances,distance,integers,modulo,1000000007,pairs,sum,bits,number,
Fizzbuzz is one of the most basic problems in the coding interview world. Try to write a small and elegant code for this problem. Given a positive integer A, return an array of strings with all the integers from 1 to N. But for multiples of 3 the array should have “Fizz” instead of the number. For the multiples of 5, the array should have “Buzz” instead of the number. For numbers which are multiple of 3 and 5 both, the array should have “FizzBuzz” instead of the number. /splitsign/Math,fizzbuzz,fizz,strings,buzz,integers,multiples,integer,array,coding,numbers,
Given 2 non negative integers m and n, find gcd(m, n) . GCD of 2 integers m and n is defined as the greatest integer g such that g is a divisor of both m and n. Both m and n fit in a 32 bit signed integer. /splitsign/Math,gcd,divisor,integers,integer,32,signed,bit,given,greatest,non,
Given a string, find the rank of the string amongst its permutations sorted lexicographically. Note that the characters might be repeated. If the characters are repeated, we need to look at the rank in unique permutations. /splitsign/Math,permutations,rank,string,sorted,lexicographically,unique,characters,repeated,given,need,
Given a number A in a form of string. You have to find the smallest number that has same set of digits as A and is greater than A. If A is the greatest possible number with its set of digits, then return -1. /splitsign/Math,digits,number,string,smallest,greater,return,set,greatest,given,form,
There are A cities numbered from 1 to A. You have already visited M cities, the indices of which are given in an array B of M integers. If a city with index i is visited, you can visit either the city with index i-1 (i >= 2) or the city with index i+1 (i < A) if they are not already visited. Eg: if N = 5 and array M consists of [3, 4], then in the first level of moves, you can either visit 2 or 5. You keep visiting cities in this fashion until all the cities are not visited. Find the number of ways in which you can visit all the cities modulo 10^9+7. /splitsign/Math,cities,visited,visiting,visit,city,indices,moves,integers,index,10,
The robot can only move either down or right at any point in time. The robot is trying to reach the bottom-right corner of the grid (marked ‘Finish’ in the diagram below). How many possible unique paths are there? /splitsign/Math,paths,robot,grid,reach,corner,unique,diagram,right,finish,possible,
Given a singly linked list and an integer K, reverses the nodes of thelist K at a time and returns modified linked list. /splitsign/Linked Lists,reverses,nodes,list,linked,thelist,returns,modified,given,integer,time,
Given a linked list A of length N and an integer B.You need to reverse every alternate B nodes in the linked list A /splitsign/Linked Lists,reverse,nodes,list,linked,alternate,integer,length,given,need,
Given a Linked List A consisting of N nodes.The Linked List is binary i.e data values in the linked list nodes consist of only 0's and 1's.You need to sort the linked list and return the new linked list. /splitsign/Linked Lists,sort,nodes,list,binary,linked,return,data,new,values,given,
Given a linked list and a value x, partition it such that all nodes less than x come before nodes greater than or equal to x.You should preserve the original relative order of the nodes in each of the two partitions. /splitsign/Linked Lists,nodes,partitions,partition,list,order,linked,preserve,greater,relative,value,
Given a linked list A of length N and an integer B.You need to find the value of the Bth node from the middle towards the beginning of the Linked List A.If no such element exists, then return -1. /splitsign/Linked Lists,node,list,linked,integer,element,return,value,length,given,middle,
Reverse a linked list from position m to n. Do it in-place and in one-pass.Given a singly linked list, determine if its a palindrome. Return 1 or 0 denoting if its a palindrome or not, respectively. /splitsign/Linked Lists,palindrome,reverse,list,return,position,determine,linked,denoting,place,given,
Given a sorted linked list, delete all nodes that have duplicate numbers, leaving only distinct numbers from the original list. /splitsign/Linked Lists,distinct,nodes,delete,linked,list,duplicate,sorted,numbers,original,leaving,
Merge two sorted linked lists and return it as a new list. The new list should be made by splicing together the nodes of the first two lists, and should also be sorted. /splitsign/Linked Lists,lists,merge,list,linked,sorted,splicing,nodes,return,new,
Given a sorted linked list, delete all duplicates such that each element appear only once.Given a linked list, remove the nth node from the end of list and return its head /splitsign/Linked Lists,node,head,sorted,remove,linked,list,duplicates,delete,element,nth,
Given a linked list A , reverse the order of all nodes at even positions.Given a linked list, swap every two adjacent nodes and return its head. /splitsign/Linked Lists,reverse,nodes,adjacent,swap,order,list,linked,head,positions,return,
Given a linked list, swap every two adjacent nodes and return its head. /splitsign/Linked Lists,swap,nodes,adjacent,head,linked,list,return,given,
Given an directed graph having A nodes labelled from 1 to A containing M edges given by matrix B of size M x 2such that there is a edge directed from nodeB[i][0] to node B[i][1].Find whether a path exists from node 1 to node A.Return 1 if path exists else return 0. /splitsign/Graph Data Structure & Algorithms,matrix,nodes,path,graph,node,edges,nodeb,edge,directed,exists,
